"DESCRIPTION","DURATION IN MS","NAME","PARENT SUITE","START TIME","STATUS","STOP TIME","SUB SUITE","SUITE","TEST CLASS","TEST METHOD"
"","1715","should load showroom on France (https://www.europages-staging.fr)","regression","2026-06-15","passed","2026-06-15","domain-smoke","showroom","",""
"","1005","should load the direct request page for europages in SPANISH (es)","regression","2026-06-15","broken","2026-06-15","direct-request-regression","requests","",""
"","10356","should keep results after verified filter and new header search","regression","2026-06-15","passed","2026-06-15","ai-company-search-regression","company-search","",""
"","1147","should load the RFQ landing page for europages in SPANISH (es)","regression","2026-06-15","passed","2026-06-15","rfq-landing-regression","requests","",""
"","3657","should navigate away from homepage after searching","regression","2026-06-15","passed","2026-06-15","ep-homepage-regression","homepage","",""
"","17370","should search for companies in French","smoke","2026-06-15","failed","2026-06-15","","company-search-smoke","",""
"","4470","should display ""Verified suppliers in your locality"" widget","regression","2026-06-15","passed","2026-06-15","recommendations-regression","product-search","",""
"","4590","should display conversation header tabs on europages","smoke","2026-06-15","passed","2026-06-15","","conversations-smoke","",""
"","5103","should have valid URLs for all navigation elements","regression","2026-06-15","passed","2026-06-15","ai-company-search-regression","company-search","",""
"","1330","should display the success page and supplier data","regression","2026-06-15","passed","2026-06-15","direct-request-e2e","requests","",""
"","1042","should display filters or sorting controls","regression","2026-06-15","passed","2026-06-15","ep-showroom-regression","showroom","",""
"","4748","should open sorting options","smoke","2026-06-15","passed","2026-06-15","","ai-company-search-smoke","",""
"","2086","should show a non-empty current page breadcrumb","regression","2026-06-15","broken","2026-06-15","direct-request-e2e","requests","",""
"","1764","should load showroom on Austria (https://www.wlw-staging.at)","regression","2026-06-15","passed","2026-06-15","domain-smoke","showroom","",""
"","1040","should display product search results container","regression","2026-06-15","passed","2026-06-15","ep-showroom-regression","showroom","",""
"","1590","should not log any errors on direct request page without product","regression","2026-06-15","broken","2026-06-15","direct-request-e2e","requests","",""
"","7469","should load United Kingdom domain with company search","regression","2026-06-15","passed","2026-06-15","domain-smoke","company-search","",""
"","15","should have wlw domains configured for company search testing","regression","2026-06-15","passed","2026-06-15","domain-smoke","company-search","",""
"","15398","should verify complete company card using page object method","regression","2026-06-15","failed","2026-06-15","cards-regression","company-search","",""
"","6273","should maintain Top Ranking after page interaction","regression","2026-06-15","passed","2026-06-15","product-top-ranking","product-search","",""
"","1659","should load the direct request page for wlw in ENGLISH (en)","regression","2026-06-15","broken","2026-06-15","direct-request-regression","requests","",""
"","9181","should run a new search from the header search form","regression","2026-06-15","passed","2026-06-15","ai-company-search-regression","company-search","",""
"","2218","should load Switzerland domain with default language","regression","2026-06-15","passed","2026-06-15","domain-smoke","product-search","",""
"","4310","should verify portfolio product details when portfolio is shown","regression","2026-06-15","passed","2026-06-15","ai-company-search-regression","company-search","",""
"","1430","should display product cards with core structure","regression","2026-06-15","passed","2026-06-15","wlw-showroom-regression","showroom","",""
"","2465","should display major homepage sections when available","regression","2026-06-15","passed","2026-06-15","wlw-homepage-regression","homepage","",""
"","5536","should display Top Ranking labels only in first 5 company cards","regression","2026-06-15","passed","2026-06-15","company-top-ranking","company-search","",""
"","12707","should maintain filters after search","regression","2026-06-15","passed","2026-06-15","filters-regression","company-search","",""
"","5232","should display and open sorting options","regression","2026-06-15","broken","2026-06-15","filters-regression","company-search","",""
"","1157","should load the direct request page for europages in ITALIAN (it)","regression","2026-06-15","broken","2026-06-15","direct-request-regression","requests","",""
"","4850","should display breadcrumbs","regression","2026-06-15","passed","2026-06-15","ai-company-search-regression","company-search","",""
"","2152","should load homepage on Italy (https://www.europages-staging.it)","regression","2026-06-15","passed","2026-06-15","domain-smoke","homepage","",""
"","1632","should load showroom with breadcrumbs, results and product cards","smoke","2026-06-15","passed","2026-06-15","","ep-showroom-smoke","",""
"","5320","should display all filters and verify basic location interactions","regression","2026-06-15","passed","2026-06-15","ai-company-search-regression","company-search","",""
"","1093","should show the breadcrumb with supplier name","regression","2026-06-15","passed","2026-06-15","direct-request-e2e","requests","",""
"","1080","should load the RFQ success page for europages in FRENCH (fr)","regression","2026-06-15","passed","2026-06-15","rfq-success-regression","requests","",""
"","5187","should display all filters and verify basic location interactions","regression","2026-06-15","passed","2026-06-15","ai-company-search-regression","company-search","",""
"","4070","should display Top Ranking labels only in first 5 product cards","regression","2026-06-15","passed","2026-06-15","product-top-ranking","product-search","",""
"","19108","should maintain filters after search","regression","2026-06-15","passed","2026-06-15","filters-regression","product-search","",""
"","654","should load the RFQ success page for europages in SPANISH (es)","regression","2026-06-15","passed","2026-06-15","rfq-success-regression","requests","",""
"","5095","should load AI company search page in English","smoke","2026-06-15","passed","2026-06-15","","ai-company-search-smoke","",""
"","15090","should load Germany domain with company search","regression","2026-06-15","failed","2026-06-15","domain-smoke","company-search","",""
"","7338","should navigate with arrow buttons (4 products per page)","regression","2026-06-15","passed","2026-06-15","recommendations-regression","product-search","",""
"","10679","should keep results after verified filter and new header search","regression","2026-06-15","passed","2026-06-15","ai-company-search-regression","company-search","",""
"","1311","should load the success page for wlw in ENGLISH (en)","regression","2026-06-15","passed","2026-06-15","direct-request-success-regression","requests","",""
"","1047","should load the RFQ landing page for europages in FRENCH (fr)","regression","2026-06-15","passed","2026-06-15","rfq-landing-regression","requests","",""
"","15178","should apply audit filters individually and in combination","regression","2026-06-15","passed","2026-06-15","filters-regression","company-search","",""
"","6265","should maintain Top Ranking after page interaction","regression","2026-06-15","passed","2026-06-15","company-top-ranking","company-search","",""
"","5321","should run AI reasoning panel cycle when available","regression","2026-06-15","passed","2026-06-15","ai-company-search-regression","company-search","",""
"","5026","should display optional company card elements when available","regression","2026-06-15","passed","2026-06-15","cards-regression","company-search","",""
"","2333","should load the RFQ create page for wlw in GERMAN (de)","regression","2026-06-15","passed","2026-06-15","rfq-create-regression","requests","",""
"","3620","should display functional contact button in sponsored brand","regression","2026-06-15","passed","2026-06-15","company-sponsored-brand","company-search","",""
"","6970","should detect current location button be clickable","regression","2026-06-15","passed","2026-06-15","filters-regression","product-search","",""
"","4707","should display multiple product cards in recommendations","regression","2026-06-15","passed","2026-06-15","recommendations-regression","product-search","",""
"","11926","should allow uploading a valid file and then remove it","regression","2026-06-15","failed","2026-06-15","direct-request-e2e","requests","",""
"","6759","should navigate from home to /conversations via the messages icon on wlw","smoke","2026-06-15","passed","2026-06-15","","conversations-smoke","",""
"","4638","should run AI reasoning panel touchpoint when available","smoke","2026-06-15","passed","2026-06-15","","ai-company-search-smoke","",""
"","1288","should display the FAQ section","regression","2026-06-15","passed","2026-06-15","direct-request-e2e","requests","",""
"","5979","should load europages company search page in French","smoke","2026-06-15","passed","2026-06-15","","company-search-smoke","",""
"","2157","should load homepage with key page structure","regression","2026-06-15","passed","2026-06-15","wlw-homepage-regression","homepage","",""
"","1940","should load Spain domain with default language","regression","2026-06-15","passed","2026-06-15","domain-smoke","product-search","",""
"","4027","should display sponsored brand card with images and information","regression","2026-06-15","passed","2026-06-15","company-sponsored-brand","company-search","",""
"","1949","should load Netherlands domain with default language","regression","2026-06-15","passed","2026-06-15","domain-smoke","product-search","",""
"","6263","should open an RFQ detail view and allow the supplier to navigate back","smoke","2026-06-15","passed","2026-06-15","","request-hub-smoke","",""
"","14308","should navigate to product detail page when clicking product card","regression","2026-06-15","failed","2026-06-15","recommendations-regression","product-search","",""
"","2168","should navigate away from homepage after searching","regression","2026-06-15","broken","2026-06-15","wlw-homepage-regression","homepage","",""
"","3683","should display 4 product images in sponsored brand card","regression","2026-06-15","failed","2026-06-15","product-sponsored-brand","product-search","",""
"","1312","should load the RFQ landing page for wlw in ENGLISH (en)","regression","2026-06-15","passed","2026-06-15","rfq-landing-regression","requests","",""
"","1522","should load page in German","regression","2026-06-15","passed","2026-06-15","ep-multilang","product-search","",""
"","1720","should load showroom on Poland (https://www.europages-staging.pl)","regression","2026-06-15","passed","2026-06-15","domain-smoke","showroom","",""
"","2073","should load homepage on Germany (https://www.wlw-staging.de)","regression","2026-06-15","passed","2026-06-15","domain-smoke","homepage","",""
"","4693","should open a conversation when the first card is clicked on europages","smoke","2026-06-15","passed","2026-06-15","","conversations-smoke","",""
"","4623","should display ""Product recommendations"" widget","regression","2026-06-15","passed","2026-06-15","recommendations-regression","product-search","",""
"","2061","should load homepage on Switzerland (https://www.wlw-staging.ch)","regression","2026-06-15","passed","2026-06-15","domain-smoke","homepage","",""
"","3834","should load Germany domain with default language","regression","2026-06-15","passed","2026-06-15","domain-smoke","product-search","",""
"","4409","should display company and product tabs","regression","2026-06-15","passed","2026-06-15","ai-company-search-regression","company-search","",""
"","15531","should submit the form and redirect to registration","regression","2026-06-15","passed","2026-06-15","direct-request-e2e","requests","",""
"","2022","should load homepage on Poland (https://www.europages-staging.pl)","regression","2026-06-15","passed","2026-06-15","domain-smoke","homepage","",""
"","1022","should show the breadcrumb with supplier name","regression","2026-06-15","passed","2026-06-15","direct-request-e2e","requests","",""
"","1070","should load the RFQ create page for europages in ITALIAN (it)","regression","2026-06-15","passed","2026-06-15","rfq-create-regression","requests","",""
"","5220","should perform search in German","regression","2026-06-15","passed","2026-06-15","ep-multilang","product-search","",""
"","4298","should pass CR-05 SEO dynamic elements and functional validation","regression","2026-06-15","passed","2026-06-15","cr-05-wlw-homepage-functional","homepage","",""
"","30803","should apply multiple filters together","regression","2026-06-15","failed","2026-06-15","filters-regression","product-search","",""
"","1186","should load the RFQ success page for wlw in ENGLISH (en)","regression","2026-06-15","passed","2026-06-15","rfq-success-regression","requests","",""
"","4385","should display complete product card information","regression","2026-06-15","passed","2026-06-15","recommendations-regression","product-search","",""
"","6881","should navigate with arrow buttons (4 products per page)","regression","2026-06-15","passed","2026-06-15","recommendations-regression","product-search","",""
"","7574","should run AI reasoning panel cycle when available","regression","2026-06-15","passed","2026-06-15","ai-company-search-regression","company-search","",""
"","4159","should display breadcrumbs","regression","2026-06-15","passed","2026-06-15","ai-company-search-regression","company-search","",""
"","1985","should load homepage on Netherlands (https://www.europages-staging.nl)","regression","2026-06-15","passed","2026-06-15","domain-smoke","homepage","",""
"","4910","should display and open sorting options","regression","2026-06-15","broken","2026-06-15","filters-regression","company-search","",""
"","6779","should navigate with arrow buttons (4 products per page)","regression","2026-06-15","passed","2026-06-15","recommendations-regression","product-search","",""
"","5132","should load wlw company search page in German","smoke","2026-06-15","passed","2026-06-15","","company-search-smoke","",""
"","1931","should display pagination","smoke","2026-06-15","passed","2026-06-15","","product-search-smoke","",""
"","1944","should load homepage on United Kingdom (https://www.europages-staging.co.uk)","regression","2026-06-15","passed","2026-06-15","domain-smoke","homepage","",""
"","13188","should display pagination","smoke","2026-06-15","failed","2026-06-15","","company-search-smoke","",""
"","1191","should not redirect authenticated user to login page on europages","smoke","2026-06-15","passed","2026-06-15","","conversations-smoke","",""
"","1552","should display search results in Italian","regression","2026-06-15","passed","2026-06-15","ep-multilang","product-search","",""
"","4889","should display filter options in English","smoke","2026-06-15","passed","2026-06-15","","ai-company-search-smoke","",""
