"DESCRIPTION","DURATION IN MS","NAME","PARENT SUITE","START TIME","STATUS","STOP TIME","SUB SUITE","SUITE","TEST CLASS","TEST METHOD"
"","6562","should open a conversation when the first card is clicked on wlw","smoke","2026-06-27","passed","2026-06-27","","conversations-smoke","",""
"","888","should display the breadcrumb with supplier name","smoke","2026-06-27","passed","2026-06-27","","requests-smoke","",""
"","5856","should navigate to product SERP via products tab","regression","2026-06-27","passed","2026-06-27","ai-company-search-regression","company-search","",""
"","1248","should load showroom URL and display breadcrumbs","regression","2026-06-27","passed","2026-06-27","ep-showroom-regression","showroom","",""
"","990","should load the RFQ success page for wlw in ENGLISH (en)","regression","2026-06-27","passed","2026-06-27","rfq-success-regression","requests","",""
"","2517","should load homepage on Switzerland (https://www.wlw-staging.ch)","regression","2026-06-27","passed","2026-06-27","domain-smoke","homepage","",""
"","1047","should display about section","regression","2026-06-27","passed","2026-06-27","ep-pdp-regression","pdp","",""
"","1495","should load showroom with breadcrumbs, results and product cards","smoke","2026-06-27","passed","2026-06-27","","showroom","",""
"","1123","should load the direct request page for europages in ITALIAN (it)","regression","2026-06-27","passed","2026-06-27","direct-request-regression","requests","",""
"","17652","should display the page heading and sidebar navigation","regression","2026-06-27","passed","2026-06-27","ep-business-insights-regression","my-account","",""
"","1131","should display ""Get quotes"" button in header","regression","2026-06-27","passed","2026-06-27","ep-homepage-regression","homepage","",""
"","1896","should pass CR-10 on europages PDP","regression","2026-06-27","passed","2026-06-27","cr-10-pdp-functional","pdp","",""
"","4165","should open an RFQ detail view and allow the supplier to navigate back","smoke","2026-06-27","passed","2026-06-27","","request-hub-smoke","",""
"","9531","should load homepage on Germany (https://www.wlw-staging.de)","regression","2026-06-27","failed","2026-06-27","domain-smoke","homepage","",""
"","4159","should perform search in German","regression","2026-06-27","passed","2026-06-27","ep-multilang","product-search","",""
"","2264","should display footer SEO alphabetical navigation sections","smoke","2026-06-27","passed","2026-06-27","","homepage","",""
"","1147","should display the product image and name","critical regression","2026-06-27","passed","2026-06-27","direct-request-e2e","requests","",""
"","1805","should display the page and supplier data","critical regression","2026-06-27","passed","2026-06-27","direct-request-e2e","requests","",""
"","5463","should verify complete company card using page object method","regression","2026-06-27","passed","2026-06-27","cards-regression","company-search","",""
"","2068","should display pagination","regression","2026-06-27","passed","2026-06-27","ep-cpv-regression","cpv","",""
"","1363","should display europages brand intro content paragraph","regression","2026-06-27","passed","2026-06-27","ep-homepage-regression","homepage","",""
"","770","should load the RFQ landing page for europages in SPANISH (es)","regression","2026-06-27","passed","2026-06-27","rfq-landing-regression","requests","",""
"","1395","should load showroom on Spain (https://www.europages-staging.es)","regression","2026-06-27","passed","2026-06-27","domain-smoke","showroom","",""
"","6701","should display filter options in German","smoke","2026-06-27","passed","2026-06-27","","company-search-smoke","",""
"","1000","should display product title","regression","2026-06-27","passed","2026-06-27","ep-pdp-regression","pdp","",""
"","10127","should display date filter and download button","regression","2026-06-27","passed","2026-06-27","ep-business-insights-regression","my-account","",""
"","1329","should have ""Create profile"" link pointing to /en/supplier-registration","regression","2026-06-27","passed","2026-06-27","ep-homepage-regression","homepage","",""
"","6644","should perform search in Spanish","regression","2026-06-27","passed","2026-06-27","ep-multilang","product-search","",""
"","1293","should display company name","regression","2026-06-27","passed","2026-06-27","ep-cpp-regression","cpp","",""
"","1424","should display product search results container","regression","2026-06-27","passed","2026-06-27","ep-showroom-regression","showroom","",""
"","1885","should load showroom on Netherlands (https://www.europages-staging.nl)","regression","2026-06-27","passed","2026-06-27","domain-smoke","showroom","",""
"","1314","should render the RFQ create page","critical regression","2026-06-27","passed","2026-06-27","direct-request-e2e","requests","",""
"","2054","should load CSERP URL and display breadcrumbs","regression","2026-06-27","passed","2026-06-27","wlw-cserp-regression","cserp","",""
"","1251","should not redirect authenticated user to login page on wlw","smoke","2026-06-27","passed","2026-06-27","","conversations-smoke","",""
"","1773","should display product search results container","regression","2026-06-27","passed","2026-06-27","wlw-showroom-regression","showroom","",""
"","1076","should show the breadcrumb with supplier name","critical regression","2026-06-27","passed","2026-06-27","direct-request-e2e","requests","",""
"","5951","should load AI company search page in English","smoke","2026-06-27","passed","2026-06-27","","ai-company-search-smoke","",""
"","3868","should display sponsored brand card with complete information","regression","2026-06-27","passed","2026-06-27","product-sponsored-brand","product-search","",""
"","12115","should display Products and profile / Google Ads tabs","regression","2026-06-27","passed","2026-06-27","ep-business-insights-regression","my-account","",""
"","8260","should have all about-me fields enabled","regression","2026-06-27","passed","2026-06-27","ep-my-account-regression","my-account","",""
"","1251","should display correct hero heading text","regression","2026-06-27","passed","2026-06-27","ep-homepage-regression","homepage","",""
"","843","should display breadcrumbs","regression","2026-06-27","passed","2026-06-27","ep-pdp-regression","pdp","",""
"","4654","should display optional company card elements when available","regression","2026-06-27","passed","2026-06-27","ai-company-search-regression","company-search","",""
"","8491","should run AI reasoning panel cycle when available","regression","2026-06-27","passed","2026-06-27","ai-company-search-regression","company-search","",""
"","11789","should display filter options in German","smoke","2026-06-27","failed","2026-06-27","","product-search-smoke","",""
"","6534","should run AI reasoning panel touchpoint when available","smoke","2026-06-27","passed","2026-06-27","","ai-company-search-smoke","",""
"","7662","should load Germany domain with company search","regression","2026-06-27","passed","2026-06-27","domain-smoke","company-search","",""
"","6795","should maintain Top Ranking after page interaction","regression","2026-06-27","passed","2026-06-27","company-top-ranking","company-search","",""
"","4997","should search for products in French","smoke","2026-06-27","passed","2026-06-27","","product-search-smoke","",""
"","4743","should display conversation header tabs on wlw","smoke","2026-06-27","passed","2026-06-27","","conversations-smoke","",""
"","1161","should display the product image and name","critical regression","2026-06-27","passed","2026-06-27","direct-request-e2e","requests","",""
"","1816","should display search results in German","regression","2026-06-27","passed","2026-06-27","ep-multilang","product-search","",""
"","6907","should display all filters and verify basic location interactions","regression","2026-06-27","passed","2026-06-27","ai-company-search-regression","company-search","",""
"","4974","should verify portfolio product details when portfolio is shown","regression","2026-06-27","passed","2026-06-27","ai-company-search-regression","company-search","",""
"","3359","should load CPV with breadcrumbs and product cards","smoke","2026-06-27","passed","2026-06-27","","cpv","",""
"","5535","should display and open sorting options","regression","2026-06-27","broken","2026-06-27","filters-regression","company-search","",""
"","2030","should load homepage on France (https://www.europages-staging.fr)","regression","2026-06-27","passed","2026-06-27","domain-smoke","homepage","",""
"","5622","should display filter options in English","smoke","2026-06-27","passed","2026-06-27","","ai-company-search-smoke","",""
"","20058","should keep AI reasoning panel after a header search","regression","2026-06-27","broken","2026-06-27","ai-company-search-regression","company-search","",""
"","32208","should navigate to product detail when clicking first product card","regression","2026-06-27","failed","2026-06-27","wlw-showroom-regression","showroom","",""
"","1335","should load the RFQ landing page for europages in FRENCH (fr)","regression","2026-06-27","passed","2026-06-27","rfq-landing-regression","requests","",""
"","7049","should load Poland domain with company search","regression","2026-06-27","passed","2026-06-27","domain-smoke","company-search","",""
"","2240","should display product cards","regression","2026-06-27","passed","2026-06-27","ep-cpv-regression","cpv","",""
"","1755","should load showroom on Italy (https://www.europages-staging.it)","regression","2026-06-27","passed","2026-06-27","domain-smoke","showroom","",""
"","1332","should display ""Become part of the marketplace today"" section title","regression","2026-06-27","passed","2026-06-27","ep-homepage-regression","homepage","",""
"","1394","should load homepage at correct URL","regression","2026-06-27","passed","2026-06-27","ep-homepage-regression","homepage","",""
"","1851","should display ""Discover trending products"" section title","regression","2026-06-27","passed","2026-06-27","ep-homepage-regression","homepage","",""
"","1111","should display company description","regression","2026-06-27","passed","2026-06-27","wlw-cpp-regression","cpp","",""
"","2294","should display filter controls","regression","2026-06-27","passed","2026-06-27","ep-cpv-regression","cpv","",""
"","5412","should open sorting options","smoke","2026-06-27","passed","2026-06-27","","ai-company-search-smoke","",""
"","4339","should display complete product card information","regression","2026-06-27","passed","2026-06-27","recommendations-regression","product-search","",""
"","16082","should apply audit filters individually and in combination","regression","2026-06-27","passed","2026-06-27","filters-regression","company-search","",""
"","1331","should have valid href values on all header navigation links","regression","2026-06-27","passed","2026-06-27","ep-homepage-regression","homepage","",""
"","11771","should run a new search from the header search form","regression","2026-06-27","passed","2026-06-27","ai-company-search-regression","company-search","",""
"","2742","should load page in German","regression","2026-06-27","passed","2026-06-27","ep-multilang","product-search","",""
"","1573","should display hero heading, search bar, and Get Quotes CTA","smoke","2026-06-27","passed","2026-06-27","","homepage","",""
"","7047","should load Italy domain with company search","regression","2026-06-27","passed","2026-06-27","domain-smoke","company-search","",""
"","3075","should display Top Ranking labels only in first 5 product cards","regression","2026-06-27","passed","2026-06-27","product-top-ranking","product-search","",""
"","1650","should display Explore suppliers & products section with showroom links","regression","2026-06-27","passed","2026-06-27","ep-homepage-regression","homepage","",""
"","3928","should load wlw conversations page after login","smoke","2026-06-27","passed","2026-06-27","","conversations-smoke","",""
"","1477","should display filters or sorting controls","regression","2026-06-27","passed","2026-06-27","wlw-showroom-regression","showroom","",""
"","640","should load page in English","regression","2026-06-27","passed","2026-06-27","ep-multilang","product-search","",""
"","876","should show the breadcrumb with supplier name","critical regression","2026-06-27","passed","2026-06-27","direct-request-e2e","requests","",""
"","1339","should display product image","regression","2026-06-27","passed","2026-06-27","wlw-pdp-regression","pdp","",""
"","6983","should load Netherlands domain with company search","regression","2026-06-27","passed","2026-06-27","domain-smoke","company-search","",""
"","1973","should switch between Product and Company search tabs","smoke","2026-06-27","passed","2026-06-27","","product-search-smoke","",""
"","2067","should display company description","regression","2026-06-27","passed","2026-06-27","ep-cpp-regression","cpp","",""
"","12270","should display Your visibility by country table","regression","2026-06-27","passed","2026-06-27","ep-business-insights-regression","my-account","",""
"","14828","should maintain filters after search","regression","2026-06-27","passed","2026-06-27","filters-regression","company-search","",""
