"DESCRIPTION","DURATION IN MS","NAME","PARENT SUITE","START TIME","STATUS","STOP TIME","SUB SUITE","SUITE","TEST CLASS","TEST METHOD"
"","7343","should display all filters and verify basic location interactions","regression","2026-06-27","passed","2026-06-27","filters-regression","company-search","",""
"","1906","should display person intro section with working slider navigation","smoke","2026-06-27","passed","2026-06-27","","homepage","",""
"","5476","should run AI reasoning panel cycle when available","regression","2026-06-27","passed","2026-06-27","ai-company-search-regression","company-search","",""
"","3520","should pass CR-11 on europages CPV","regression","2026-06-27","passed","2026-06-27","cr-11-cpv-functional","cpv","",""
"","6234","should load europages company search page in French","smoke","2026-06-27","passed","2026-06-27","","company-search-smoke","",""
"","3756","should load wlw product search page in German","smoke","2026-06-27","passed","2026-06-27","","product-search-smoke","",""
"","1682","should load Switzerland domain with default language","regression","2026-06-27","passed","2026-06-27","domain-smoke","product-search","",""
"","2238","should load homepage on Poland (https://www.europages-staging.pl)","regression","2026-06-27","passed","2026-06-27","domain-smoke","homepage","",""
"","14501","should apply top responder filter","regression","2026-06-27","failed","2026-06-27","filters-regression","product-search","",""
"","11763","should display Top Ranking products with data-test attribute","regression","2026-06-27","failed","2026-06-27","product-top-ranking","product-search","",""
"","4366","should display multiple product cards in recommendations","regression","2026-06-27","passed","2026-06-27","recommendations-regression","product-search","",""
"","4316","should display pagination","regression","2026-06-27","passed","2026-06-27","ai-company-search-regression","company-search","",""
"","1449","should display CPV section title","regression","2026-06-27","passed","2026-06-27","ep-homepage-regression","homepage","",""
"","24351","should apply audit filters individually and in combination","regression","2026-06-27","passed","2026-06-27","ai-company-search-regression","company-search","",""
"","1238","should display GIF banner with B2B stats and Get Multiple Quotes link","smoke","2026-06-27","passed","2026-06-27","","homepage","",""
"","9750","should display footer brand claim section with ""Start with"" text","regression","2026-06-27","failed","2026-06-27","ep-homepage-regression","homepage","",""
"","208","should have europages domains configured for company search testing","regression","2026-06-27","passed","2026-06-27","domain-smoke","company-search","",""
"","1186","should display portfolio products","regression","2026-06-27","passed","2026-06-27","wlw-cpp-regression","cpp","",""
"","1331","should display contact button","regression","2026-06-27","passed","2026-06-27","wlw-cpp-regression","cpp","",""
"","1563","should load page in Spanish","regression","2026-06-27","passed","2026-06-27","ep-multilang","product-search","",""
"","4933","should display optional company card elements when available","regression","2026-06-27","passed","2026-06-27","ai-company-search-regression","company-search","",""
"","7387","should display Security section","regression","2026-06-27","passed","2026-06-27","ep-my-account-regression","my-account","",""
"","2865","should load Germany domain with default language","regression","2026-06-27","passed","2026-06-27","domain-smoke","product-search","",""
"","31748","should create a new WLW company profile and verify it is published","regression","2026-06-27","passed","2026-06-27","wlw-company-creation-regression","supplier-onboarding","",""
"","14151","should keep results after verified filter and new header search","regression","2026-06-27","passed","2026-06-27","ai-company-search-regression","company-search","",""
"","1113","should load the direct request page for europages in SPANISH (es)","regression","2026-06-27","passed","2026-06-27","direct-request-regression","requests","",""
"","1848","should load PDP URL with product path","regression","2026-06-27","passed","2026-06-27","wlw-pdp-regression","pdp","",""
"","2354","should load the direct request page for europages in FRENCH (fr)","regression","2026-06-27","passed","2026-06-27","direct-request-regression","requests","",""
"","15","should have wlw domains configured for company search testing","regression","2026-06-27","passed","2026-06-27","domain-smoke","company-search","",""
"","7561","should display core elements on the first company card","regression","2026-06-27","passed","2026-06-27","ai-company-search-regression","company-search","",""
"","7960","should display Notifications section","regression","2026-06-27","passed","2026-06-27","ep-my-account-regression","my-account","",""
"","2455","should display breadcrumbs","regression","2026-06-27","passed","2026-06-27","wlw-cpv-regression","cpv","",""
"","4568","should display ""Trending products"" widget","regression","2026-06-27","passed","2026-06-27","recommendations-regression","product-search","",""
"","1643","should display contact button","regression","2026-06-27","passed","2026-06-27","ep-cpp-regression","cpp","",""
"","1190","should display BME seal certification section","smoke","2026-06-27","passed","2026-06-27","","homepage","",""
"","7794","should display core elements on the first company card","regression","2026-06-27","passed","2026-06-27","ai-company-search-regression","company-search","",""
"","6725","should display Top Ranking labels only in first 5 company cards","regression","2026-06-27","passed","2026-06-27","company-top-ranking","company-search","",""
"","3669","should pass CR-10 on wlw PDP","regression","2026-06-27","passed","2026-06-27","cr-10-pdp-functional","pdp","",""
"","5174","should display and open sorting options","regression","2026-06-27","passed","2026-06-27","ai-company-search-regression","company-search","",""
"","917","should not redirect authenticated user to login page on europages","smoke","2026-06-27","passed","2026-06-27","","conversations-smoke","",""
"","7112","should have valid URLs for all navigation elements","regression","2026-06-27","passed","2026-06-27","ai-company-search-regression","company-search","",""
"","5434","should display all filters and verify basic location interactions","regression","2026-06-27","passed","2026-06-27","ai-company-search-regression","company-search","",""
"","1465","should display BME seal certification section","regression","2026-06-27","passed","2026-06-27","ep-homepage-regression","homepage","",""
"","4337","should display multiple product cards in recommendations","regression","2026-06-27","passed","2026-06-27","recommendations-regression","product-search","",""
"","3711","should have valid URLs in sponsored brand card","regression","2026-06-27","passed","2026-06-27","company-sponsored-brand","company-search","",""
"","1163","should display non-empty current page breadcrumb","smoke","2026-06-27","passed","2026-06-27","","requests-smoke","",""
"","10155","should allow uploading a valid file and then remove it","critical regression","2026-06-27","failed","2026-06-27","direct-request-e2e","requests","",""
"","1779","should display CPV section title and correct showroom-cate links","smoke","2026-06-27","passed","2026-06-27","","homepage","",""
"","1007","should load the RFQ success page for europages in FRENCH (fr)","regression","2026-06-27","passed","2026-06-27","rfq-success-regression","requests","",""
"","2186","should display contact button on company cards","regression","2026-06-27","passed","2026-06-27","ep-cserp-regression","cserp","",""
"","2164","should load the success page for wlw in GERMAN (de)","regression","2026-06-27","passed","2026-06-27","direct-request-success-regression","requests","",""
"","1928","should load the direct request page for wlw in ENGLISH (en)","regression","2026-06-27","passed","2026-06-27","direct-request-regression","requests","",""
"","1495","should display ""B2B providers"" stat in GIF banner","regression","2026-06-27","passed","2026-06-27","ep-homepage-regression","homepage","",""
"","1027","should display related products","regression","2026-06-27","passed","2026-06-27","ep-pdp-regression","pdp","",""
"","1903","should load Germany domain with default language","regression","2026-06-27","passed","2026-06-27","domain-smoke","product-search","",""
"","16410","should apply audit filters individually and in combination","regression","2026-06-27","passed","2026-06-27","filters-regression","company-search","",""
"","4537","should complete user registration form and reach verification step","regression","2026-06-27","passed","2026-06-27","ep-user-creation-regression","supplier-onboarding","",""
"","2079","should load homepage on United Kingdom (https://www.europages-staging.co.uk)","regression","2026-06-27","passed","2026-06-27","domain-smoke","homepage","",""
"","1332","should display location information","regression","2026-06-27","passed","2026-06-27","wlw-cpp-regression","cpp","",""
"","912","should display header, hero, and footer","smoke","2026-06-27","passed","2026-06-27","","requests-smoke","",""
"","14144","should keep AI reasoning panel after a header search","regression","2026-06-27","passed","2026-06-27","ai-company-search-regression","company-search","",""
"","1300","should show the breadcrumb with supplier name","critical regression","2026-06-27","passed","2026-06-27","direct-request-e2e","requests","",""
"","1215","should load the success page for europages in SPANISH (es)","regression","2026-06-27","passed","2026-06-27","direct-request-success-regression","requests","",""
"","31785","should navigate to product detail when clicking first product card","regression","2026-06-27","failed","2026-06-27","ep-showroom-regression","showroom","",""
"","1882","should navigate trending products carousel with slider arrow","smoke","2026-06-27","passed","2026-06-27","","homepage","",""
"","1623","should show a non-empty current page breadcrumb","critical regression","2026-06-27","passed","2026-06-27","direct-request-e2e","requests","",""
"","9679","should display Your latest identified visitors table","regression","2026-06-27","passed","2026-06-27","ep-business-insights-regression","my-account","",""
"","3355","should load CPV URL with showroom-cate path","regression","2026-06-27","passed","2026-06-27","wlw-cpv-regression","cpv","",""
"","1452","should display ""Get a premium profile"" button","regression","2026-06-27","passed","2026-06-27","ep-homepage-regression","homepage","",""
"","4312","should display ""Verified suppliers in your locality"" widget","regression","2026-06-27","passed","2026-06-27","recommendations-regression","product-search","",""
"","1275","should render the RFQ create page","smoke","2026-06-27","passed","2026-06-27","","requests-smoke","",""
"","15177","should load Germany domain with company search","regression","2026-06-27","failed","2026-06-27","domain-smoke","company-search","",""
"","2728","should not log any errors on direct request success page","critical regression","2026-06-27","failed","2026-06-27","direct-request-e2e","requests","",""
"","3253","should display major homepage sections when available","regression","2026-06-27","passed","2026-06-27","wlw-homepage-regression","homepage","",""
"","4623","should display breadcrumbs","regression","2026-06-27","passed","2026-06-27","ai-company-search-regression","company-search","",""
"","9897","should load the RFQ create page for europages in FRENCH (fr)","regression","2026-06-27","failed","2026-06-27","rfq-create-regression","requests","",""
"","7497","should display My Companies section","regression","2026-06-27","passed","2026-06-27","ep-my-account-regression","my-account","",""
"","9692","should display at least one Inside Business article link","regression","2026-06-27","failed","2026-06-27","ep-homepage-regression","homepage","",""
"","2142","should display company search results","regression","2026-06-27","passed","2026-06-27","ep-cserp-regression","cserp","",""
"","1130","should have product name links pointing to /en/company paths","regression","2026-06-27","passed","2026-06-27","ep-homepage-regression","homepage","",""
"","2830","should display a list of available RFQs","smoke","2026-06-27","passed","2026-06-27","","request-hub-smoke","",""
"","36307","should not log any errors on direct request page with product","critical regression","2026-06-27","failed","2026-06-27","direct-request-e2e","requests","",""
"","756","should contain candidateRequestId in the URL","critical regression","2026-06-27","passed","2026-06-27","direct-request-e2e","requests","",""
"","2389","should navigate person intro slider with next and prev arrows","regression","2026-06-27","passed","2026-06-27","ep-homepage-regression","homepage","",""
"","2092","should scroll trending products carousel forward with next arrow","regression","2026-06-27","passed","2026-06-27","ep-homepage-regression","homepage","",""
"","2915","should pass CR-06 SEO dynamic elements and functional validation","regression","2026-06-27","passed","2026-06-27","cr-06-ep-homepage-functional","homepage","",""
"","2604","should load the RFQ create page for wlw in GERMAN (de)","regression","2026-06-27","passed","2026-06-27","rfq-create-regression","requests","",""
"","4832","should display pagination","regression","2026-06-27","passed","2026-06-27","ai-company-search-regression","company-search","",""
"","2225","should load the RFQ create page for europages in ITALIAN (it)","regression","2026-06-27","passed","2026-06-27","rfq-create-regression","requests","",""
"","1553","should display Top products section with /en/pdp links","regression","2026-06-27","passed","2026-06-27","ep-homepage-regression","homepage","",""
"","12177","should display pagination","smoke","2026-06-27","failed","2026-06-27","","company-search-smoke","",""
"","1064","should display the success page and supplier data","critical regression","2026-06-27","passed","2026-06-27","direct-request-e2e","requests","",""
"","9389","should display ""List my company"" button in header","regression","2026-06-27","failed","2026-06-27","ep-homepage-regression","homepage","",""
"","10151","should display core page structure (header, search bar, footer)","regression","2026-06-27","failed","2026-06-27","ep-homepage-regression","homepage","",""
"","19472","should maintain filters after search","regression","2026-06-27","passed","2026-06-27","filters-regression","product-search","",""
"","1285","should display EP logo in header","regression","2026-06-27","passed","2026-06-27","ep-homepage-regression","homepage","",""
"","9253","should display Products and services table with data","regression","2026-06-27","passed","2026-06-27","ep-business-insights-regression","my-account","",""
"","3999","should display sponsored brand card with images and information","regression","2026-06-27","passed","2026-06-27","company-sponsored-brand","company-search","",""
"","9048","should display Notifications section","regression","2026-06-27","passed","2026-06-27","wlw-my-account-regression","my-account","",""
"","15452","should submit the form and redirect to registration","critical regression","2026-06-27","passed","2026-06-27","direct-request-e2e","requests","",""
"","1461","should display search bar in hero section","regression","2026-06-27","passed","2026-06-27","ep-homepage-regression","homepage","",""
"","4210","should navigate with arrow buttons (4 products per page)","regression","2026-06-27","passed","2026-06-27","recommendations-regression","product-search","",""
"","10894","should sign in successfully with valid supplier (paid customer) credentials","smoke","2026-06-27","passed","2026-06-27","","wlw-login-smoke","",""
"","2241","should display the page and supplier data","critical regression","2026-06-27","passed","2026-06-27","direct-request-e2e","requests","",""
"","6164","should display optional company card elements when available","regression","2026-06-27","passed","2026-06-27","cards-regression","company-search","",""
"","1589","should load PDP URL with product path","regression","2026-06-27","passed","2026-06-27","ep-pdp-regression","pdp","",""
"","9340","should navigate to product detail page when clicking product card","regression","2026-06-27","passed","2026-06-27","recommendations-regression","product-search","",""
"","1457","should display contact button on company cards","regression","2026-06-27","passed","2026-06-27","wlw-cserp-regression","cserp","",""
"","1811","should display Top Searches section with /companies links","regression","2026-06-27","passed","2026-06-27","ep-homepage-regression","homepage","",""
"","9951","should navigate to product detail page when clicking product card","regression","2026-06-27","passed","2026-06-27","recommendations-regression","product-search","",""
"","893","should load the RFQ success page for europages in ITALIAN (it)","regression","2026-06-27","passed","2026-06-27","rfq-success-regression","requests","",""
"","2294","should not log any errors on direct request page without product","critical regression","2026-06-27","failed","2026-06-27","direct-request-e2e","requests","",""
"","587","should load the success page for europages in ITALIAN (it)","regression","2026-06-27","passed","2026-06-27","direct-request-success-regression","requests","",""
"","1108","should display the page and supplier data","critical regression","2026-06-27","passed","2026-06-27","direct-request-e2e","requests","",""
"","6192","should display and open sorting options","regression","2026-06-27","broken","2026-06-27","filters-regression","company-search","",""
"","1396","should display pagination or quotes entry","regression","2026-06-27","passed","2026-06-27","wlw-showroom-regression","showroom","",""
"","7589","should display the correct footer links","regression","2026-06-27","passed","2026-06-27","wlw-my-account-regression","my-account","",""
"","9979","should display ""Sign in"" button in header","regression","2026-06-27","failed","2026-06-27","ep-homepage-regression","homepage","",""
"","1378","should load the success page for wlw in ENGLISH (en)","regression","2026-06-27","passed","2026-06-27","direct-request-success-regression","requests","",""
"","1589","should display at least 3 CPV second-level category groups","regression","2026-06-27","passed","2026-06-27","ep-homepage-regression","homepage","",""
"","1276","should display ""Request Hub"" button in header","regression","2026-06-27","passed","2026-06-27","ep-homepage-regression","homepage","",""
"","4306","should display conversation header tabs on europages","smoke","2026-06-27","passed","2026-06-27","","conversations-smoke","",""
"","3924","should display breadcrumbs","smoke","2026-06-27","passed","2026-06-27","","company-search-smoke","",""
"","2227","should scroll product recommendation carousel back with prev arrow","regression","2026-06-27","passed","2026-06-27","ep-homepage-regression","homepage","",""
"","2033","should display first company card with name","regression","2026-06-27","passed","2026-06-27","ep-cserp-regression","cserp","",""
"","3591","should pass CR-11 on wlw CPV","regression","2026-06-27","passed","2026-06-27","cr-11-cpv-functional","cpv","",""
"","673","should load the RFQ landing page for europages in ITALIAN (it)","regression","2026-06-27","passed","2026-06-27","rfq-landing-regression","requests","",""
"","7272","should display Your connections to buyers section","regression","2026-06-27","passed","2026-06-27","ep-business-insights-regression","my-account","",""
"","8344","should detect current location button be clickable","regression","2026-06-27","passed","2026-06-27","filters-regression","product-search","",""
"","6135","should display all required company card basic elements","regression","2026-06-27","passed","2026-06-27","cards-regression","company-search","",""
"","7416","should display Your visibility section with impressions and page views","regression","2026-06-27","passed","2026-06-27","ep-business-insights-regression","my-account","",""
"","2251","should load showroom on Germany (https://www.wlw-staging.de)","regression","2026-06-27","passed","2026-06-27","domain-smoke","showroom","",""
"","7035","should load Spain domain with company search","regression","2026-06-27","passed","2026-06-27","domain-smoke","company-search","",""
"","2578","should load showroom URL and display breadcrumbs","regression","2026-06-27","passed","2026-06-27","wlw-showroom-regression","showroom","",""
"","1898","should scroll product recommendation carousel forward with next arrow","regression","2026-06-27","passed","2026-06-27","ep-homepage-regression","homepage","",""
"","4792","should load CPP with company name and contact button","smoke","2026-06-27","passed","2026-06-27","","cpp","",""
"","5738","should perform search in English","regression","2026-06-27","passed","2026-06-27","ep-multilang","product-search","",""
"","1170","should display the breadcrumb with supplier name","smoke","2026-06-27","passed","2026-06-27","","requests-smoke","",""
"","1791","should load the RFQ landing page for wlw in GERMAN (de)","regression","2026-06-27","passed","2026-06-27","rfq-landing-regression","requests","",""
"","3072","should pass CR-05 SEO dynamic elements and functional validation","regression","2026-06-27","passed","2026-06-27","cr-05-wlw-homepage-functional","homepage","",""
"","1903","should display pagination","regression","2026-06-27","passed","2026-06-27","ep-cserp-regression","cserp","",""
"","609","should load page in French","regression","2026-06-27","passed","2026-06-27","ep-multilang","product-search","",""
"","4585","should navigate away from homepage after searching","regression","2026-06-27","passed","2026-06-27","wlw-homepage-regression","homepage","",""
"","4850","should display required company card basic elements","regression","2026-06-27","passed","2026-06-27","ai-company-search-regression","company-search","",""
"","1602","should load showroom on United Kingdom (https://www.europages-staging.co.uk)","regression","2026-06-27","passed","2026-06-27","domain-smoke","showroom","",""
"","3561","should display functional contact button in sponsored brand","regression","2026-06-27","passed","2026-06-27","company-sponsored-brand","company-search","",""
"","7705","should display the correct footer links","regression","2026-06-27","passed","2026-06-27","ep-my-account-regression","my-account","",""
"","1725","should open contact flow when clicking contact button","regression","2026-06-27","passed","2026-06-27","wlw-pdp-regression","pdp","",""
"","3094","should have maximum 5 products with Top Ranking label","regression","2026-06-27","passed","2026-06-27","product-top-ranking","product-search","",""
"","12331","should keep results after verified filter and new header search","regression","2026-06-27","passed","2026-06-27","ai-company-search-regression","company-search","",""
"","9862","should have ""Go to Inside Business"" link pointing to /inside-business/start","regression","2026-06-27","failed","2026-06-27","ep-homepage-regression","homepage","",""
"","6802","should navigate with arrow buttons (4 products per page)","regression","2026-06-27","passed","2026-06-27","recommendations-regression","product-search","",""
"","647","should load page in Italian","regression","2026-06-27","passed","2026-06-27","ep-multilang","product-search","",""
"","1014","should load the RFQ landing page for wlw in ENGLISH (en)","regression","2026-06-27","passed","2026-06-27","rfq-landing-regression","requests","",""
"","2137","should display first product card structure","regression","2026-06-27","passed","2026-06-27","ep-cpv-regression","cpv","",""
"","1607","should display Find more companies section with /en/cpp links","regression","2026-06-27","passed","2026-06-27","ep-homepage-regression","homepage","",""
"","2216","should display breadcrumbs","regression","2026-06-27","passed","2026-06-27","ep-cpv-regression","cpv","",""
"","1675","should display search results in French","regression","2026-06-27","passed","2026-06-27","ep-multilang","product-search","",""
"","2374","should load europages product search page in French","smoke","2026-06-27","passed","2026-06-27","","product-search-smoke","",""
"","2229","should load Italy domain with default language","regression","2026-06-27","passed","2026-06-27","domain-smoke","product-search","",""
"","6055","should navigate to product SERP via products tab","regression","2026-06-27","passed","2026-06-27","ai-company-search-regression","company-search","",""
"","33005","should navigate away from CPV when clicking first product card","regression","2026-06-27","failed","2026-06-27","wlw-cpv-regression","cpv","",""
"","7147","should load Switzerland domain with company search","regression","2026-06-27","passed","2026-06-27","domain-smoke","company-search","",""
"","5082","should display company and product tabs","regression","2026-06-27","passed","2026-06-27","ai-company-search-regression","company-search","",""
"","10455","should have all about-me fields enabled","regression","2026-06-27","passed","2026-06-27","wlw-my-account-regression","my-account","",""
"","2525","should load Netherlands domain with default language","regression","2026-06-27","passed","2026-06-27","domain-smoke","product-search","",""
"","10268","should display all filter options","regression","2026-06-27","failed","2026-06-27","filters-regression","product-search","",""
"","8637","should display the correct first and last name","regression","2026-06-27","passed","2026-06-27","ep-my-account-regression","my-account","",""
"","9976","should display the correct page heading","regression","2026-06-27","passed","2026-06-27","ep-my-account-regression","my-account","",""
